{
  "bindingSetId": "binding-set.synthetic.cca-210-render",
  "bindings": {
    "evidenceProvenance": {
      "byteLength": 7317,
      "contractId": "cryptocomm-evidence-provenance/v1",
      "digest": {
        "algorithm": "sha256",
        "value": "c9ce86b71a32b4d5ff9179a985c7f9ef63c8f317840bfce8375cc35f05d8d0e1"
      },
      "recordId": "provenance.synthetic.cca-210-render"
    },
    "executionResult": {
      "byteLength": 9140,
      "contractId": "cryptocomm-execution-result/v1",
      "digest": {
        "algorithm": "sha256",
        "value": "0bce96405685a52e0091e15978ecd8d89b0206432d41f9f4eaa8848ee144c06f"
      },
      "recordId": "result.synthetic.cca-210-render"
    },
    "freshnessAssessment": {
      "byteLength": 2360,
      "contractId": "cryptocomm-freshness-assessment/v1",
      "digest": {
        "algorithm": "sha256",
        "value": "9ec9a622f0c40a742a687cac02cc5b049520f8fca23ca9a35bd6fc2965db6d93"
      },
      "recordId": "assessment.synthetic.cca-210-not-assessed"
    }
  },
  "diagnostics": [],
  "fixtureClassification": "synthetic-test-only",
  "safety": {
    "executable": false,
    "networkRequired": false,
    "secretsAllowed": false
  },
  "schemaVersion": "cryptocomm-evidence-binding-set/v1",
  "scope": {
    "description": "Synthetic repository-local CCA-210 renderer fixture scope.",
    "exclusions": [
      "claim satisfaction",
      "live systems",
      "private evidence",
      "product compatibility"
    ],
    "scopeId": "scope.synthetic.cca-210-target"
  },
  "subject": {
    "commit": {
      "algorithm": "git-sha1",
      "value": "1111111111111111111111111111111111111111"
    },
    "kind": "git-revision",
    "repositoryId": "example.test:synthetic/crypto-target",
    "tree": {
      "algorithm": "git-sha1",
      "value": "2222222222222222222222222222222222222222"
    }
  }
}
